Brand,Product,Gender,Product_Type,Price,Sold,Available,Revenue_Potential,Demand_Score,Price_Category,Market_Segment,Sales_Performance,Brand_Popularity,Country,Inventory_Status,Stock_Turnover,Revenue_Rank
Clinique,Clinique Happy by Clinique 3.3 / 3.4 oz Perfume EDP Spray for women NEW IN BOX,Women,EDP,21.27,61.0,2.0,1297.47,49.080999999999996,Budget,Mass Market,Medium Seller,Medium,United States,Low Stock,Fast,Others
Ralph Lauren,Polo Ralph Lauren Black EDT Eau De Toilette 2.5 oz. NIB! SEALED!,Men,EDT,25.0,8.0,5.0,200.0,13.1,Budget,Mass Market,Low Seller,High,United States,Medium Stock,Slow,Others
Zara,Zara Hello kitty Eau De Toilette 1.69 fl oz/50ml Perfume Fragrance Spray,Women,Eau De Toilette,24.99,3.0,7.0,74.97,9.596999999999998,Budget,Mass Market,Low Seller,Low,United States,Medium Stock,Slow,Others
Viktor & Rolf,"Spicebomb Night Vision by Viktor & Rolf, 3 oz EDP Spray for Men",Men,EDP,74.92,116.0,6.0,8690.72,103.67599999999999,Mid-Range,Premium,High Seller,Medium,United States,Medium Stock,Fast,Others
Ralph Lauren,Polo Red by Ralph Lauren EDT for Men 4.2 oz - 125 ml NEW IN BOX SEALED,Men,EDT,29.99,169.0,8.0,5068.3099999999995,127.297,Budget,Mass Market,High Seller,High,United States,Medium Stock,Fast,Others
Lacoste,Lacoste Style in Play RED Men 4.2 oz 125 ml Eau De Toilette Spray Same As Photo,Men,Eau De Toilette,47.34,14.0,4.0,662.76,24.002,Mid-Range,Premium,Low Seller,Low,United States,Low Stock,Moderate,Others
Daddy Yankee,Dyamante by Daddy Yankee 3.4 oz Eau De Parfum Spray for women New in box,Women,Parfum,12.15,533.0,6.0,6475.95,376.74499999999995,Budget,Mass Market,High Seller,Low,United States,Medium Stock,Fast,Others
Lalique,Lalique by Lalique cologne for men EDP 4.2 oz New in Box,Men,EDP,31.47,397.0,48.0,12493.59,287.34099999999995,Mid-Range,Premium,High Seller,Low,United States,High Stock,Fast,Top 25%
Paco Rabanne,Invictus by Paco Rabanne cologne for men EDT 6.8 oz New In Box,Men,EDT,77.15,293.0,8.0,22604.95,228.245,Mid-Range,Premium,High Seller,High,United States,Medium Stock,Fast,Top 25%
Bvlgari,BVLGARI ROSE GOLDEA BLOSSOM DELIGHT EAU DE PARFUM 0.5OZ 15ML VAPORISATEUR  SPRAY,Women,Parfum,24.5,18.0,10.0,441.0,19.95,Budget,Mass Market,Low Seller,Medium,United States,Medium Stock,Slow,Others
Carolina Herrera,Bad Boy by Carolina Herrera 5.1 oz. Eau de Toilette Spray for Men. New. NO Box,Men,Eau De Toilette,54.99,780.0,10.0,42892.200000000004,562.497,Mid-Range,Premium,High Seller,High,United States,Medium Stock,Fast,Top 10%
Emporio Armani,Stronger With You by Emporio Armani 3.3 oz. Eau de Toilette Spray Men Sealed Box,Men,Eau De Toilette,71.9,244.0,10.0,17543.600000000002,192.36999999999998,Mid-Range,Premium,High Seller,Low,United States,Medium Stock,Fast,Top 25%
Yves Saint Laurent,Yves Saint Laurent Libre YSL Eau de Parfum Spray 3 fl oz for Women New With Box,Women,Parfum,59.99,26.0,4.0,1559.74,36.197,Mid-Range,Premium,Medium Seller,High,Hong Kong,Low Stock,Fast,Others
Jo Malone,Jo Malone London English Pear & Sweet Pea Cologne travel size 9ml/0.3fl.oz NEW!!,Women,Cologne,16.99,39.0,10.0,662.6099999999999,32.397,Budget,Mass Market,Medium Seller,High,United States,Medium Stock,Moderate,Others
Creed,Creed Aventus Eau De Parfum Travel Size Spray 10ml / 0.33oz Batch F002525 Sample,Men,Parfum,38.99,20.0,10.0,779.8000000000001,25.697000000000003,Mid-Range,Premium,Medium Seller,Medium,United States,Medium Stock,Slow,Others
Giorgio Armani,Armani Code By Giorgio Armani 4.2 oz Mens Eau de Toilette Spray NEW & SEALED BOX,Men,Eau De Toilette,39.99,26.0,8.0,1039.74,30.197,Mid-Range,Premium,Medium Seller,High,United States,Medium Stock,Moderate,Others
Dolce&Gabbana,Dolce & Gabbana DOLCE VIOLET Women Perfume 5ml EDT Splash MINI Travel Size (C61,Women,EDT,18.95,9.0,8.0,170.54999999999998,11.985,Budget,Mass Market,Low Seller,High,United States,Medium Stock,Slow,Others
Coach,Coach Dreams Sunset by Coach perfume for women EDP 3.0 oz New in Box,Women,EDP,41.58,298.0,174.0,12390.84,221.07399999999998,Mid-Range,Premium,High Seller,Medium,United States,High Stock,Slow,Top 25%
Dolce&Gabbana,Dolce & Gabbana Light Blue Men 4.2 oz / 125 mL EDT Spray Brand New & Sealed,Men,EDT,29.95,458.0,7.0,13717.1,329.585,Budget,Mass Market,High Seller,High,United States,Medium Stock,Fast,Top 25%
Azzaro,Azzaro Chrome PARFUM Spray for Men 3.3 oz. Launched in 2023. New in Sealed Box.,Men,Parfum,44.0,83.0,10.0,3652.0,71.3,Mid-Range,Premium,Medium Seller,Medium,United States,Medium Stock,Fast,Others
Burberry,Burberry Touch by Burberry EDT Cologne for Men 3.3 / 3.4 oz Brand New Tester,Men,EDT,28.25,12583.0,10.0,355469.75,8816.574999999999,Budget,Mass Market,High Seller,High,United States,Medium Stock,Fast,Top 10%
Dolce&Gabbana,Dolce & Gabbana Light Blue 3.3 /3.4 oz Women’s Eau de Toilette Spray NEW,Women,Eau De Toilette,27.9,118.0,2.0,3292.2,90.97,Budget,Mass Market,High Seller,High,United States,Low Stock,Fast,Others
Donna Karan,Cashmere Mist by Donna Karan 3.4 oz / 100mL Spray for Women EDP Brand New Sealed,Women,EDP,29.99,223.0,10.0,6687.7699999999995,165.09699999999998,Budget,Mass Market,High Seller,Low,United States,Medium Stock,Fast,Others
PINK,Rue 21 Pink ICE Perfume Spray 1.7 FL OZ New (Unboxed),Women,Unknown,22.45,2.0,5.0,44.9,8.135,Budget,Mass Market,Low Seller,Low,United States,Medium Stock,Slow,Others
Louis Vuitton,Louis Vuitton Meteore Eau de Parfum Sample Spray - 2ml/0.06oz,Men,Parfum,18.95,624.0,10.0,11824.8,442.48499999999996,Budget,Mass Market,High Seller,Low,United States,Medium Stock,Fast,Top 25%
Elizabeth Taylor,"Elizabeth Taylor Perfume Gift Set, White Diamonds , 2 Pieces",Women,Unknown,18.87,1.0,0.0,18.87,6.361000000000001,Budget,Mass Market,Low Seller,Low,United States,Low Stock,Fast,Others
MEM,Complete Set of 7 Love's Baby Soft by MEM  Unboxed Original 90s pl read below,Women,Unknown,28.0,6.0,10.0,168.0,12.6,Budget,Mass Market,Low Seller,Low,United States,Medium Stock,Slow,Others
J. Del Pozo,Halloween Man X by Jesus Del Pozo 4.2 oz EDT Cologne for Men New In Box,Men,EDT,37.98,612.0,10.0,23243.76,439.794,Mid-Range,Premium,High Seller,Low,United States,Medium Stock,Fast,Top 25%
Does not apply,Perfume For Men With Pheromones To Attract Women Fragrance Cologne Masculino,Men,Cologne,16.34,103.0,5.0,1683.02,77.002,Budget,Mass Market,High Seller,Low,United States,Medium Stock,Fast,Others
Giorgio Armani,Giorgio Armani Aqua Di Gio Men 3.4 oz EDT Aquatic Fresh Fragrance New,Men,EDT,29.99,410.0,10.0,12295.9,295.997,Budget,Mass Market,High Seller,High,United States,Medium Stock,Fast,Top 25%
Cologne,PACO RABANNE Phantom Parfum 0.17oz/5mL Mens - Mini Size Cologne - New In Box!,Men,Parfum,24.99,2.0,0.0,49.98,8.896999999999998,Budget,Mass Market,Low Seller,Medium,United States,Low Stock,Fast,Others
Cacharel,Noa by Cacharel for Women Eau de Toilette Spray - 1 fl oz - SPRING SALE !,Women,Eau De Toilette,20.0,79.0,10.0,1580.0,61.3,Budget,Mass Market,Medium Seller,Low,United States,Medium Stock,Fast,Others
Dolce & Gabbana,"Light Blue Eau Intense by Dolce & Gabbana, 6.7 oz EDP Spray for Men",Men,EDP,69.02,370.0,10.0,25537.399999999998,279.706,Mid-Range,Premium,High Seller,Medium,United States,Medium Stock,Fast,Top 25%
Armaf,Tag - Him Pour Homme by Armaf cologne EDP 3.3 / 3.4 oz New in Box,Men,EDP,21.15,739.0,95.0,15629.849999999999,523.645,Budget,Mass Market,High Seller,High,United States,High Stock,Fast,Top 25%
Ariana Grande,Cloud by Ariana Grande Perfume 3.4 oz Eau de Parfum EDP for Women BRAND NEW!!,Women,EDP,32.0,10.0,9.0,320.0,16.6,Mid-Range,Premium,Low Seller,Medium,United States,Medium Stock,Slow,Others
Versace,Versace Dylan Turquoise by Gianni Versace for women EDT 3.3 / 3.4 oz New Tester,Women,EDT,32.2,157.0,60.0,5055.400000000001,119.55999999999999,Mid-Range,Premium,High Seller,High,United States,High Stock,Moderate,Others
Valentino,Valentino Uomo Born In Roma 3.4.Oz /100ML Eau De Toilette Spray for Men,Men,Eau De Toilette,75.99,8.0,2.0,607.92,28.397,Mid-Range,Premium,Low Seller,Medium,Hong Kong,Low Stock,Moderate,Others
Calvin Klein,CK IN2U HER Calvin Klein perfume edt 3.4 oz 3.3 NEW TESTER,Women,EDT,17.57,83.0,62.0,1458.31,63.370999999999995,Budget,Mass Market,Medium Seller,High,United States,High Stock,Slow,Others
Guerlain,Guerlain NEROLI OUTRENOIR Eau de Parfum 2ml /.06oz Sample Spray NIB,Women,Parfum,13.0,94.0,10.0,1222.0,69.7,Budget,Mass Market,Medium Seller,Low,United States,Medium Stock,Fast,Others
Paco Rabanne,Paco Rabanne PHANTOM Parfum 1.7 oz / 50 ml Men's Spray,Men,Parfum,82.99,2.0,10.0,165.98,26.296999999999997,Luxury,Luxury,Low Seller,High,United States,Medium Stock,Slow,Others
Lancôme,La Vie Est Belle By Lancôme 2.5 OZ L'Eau De Parfum For Women,Women,Parfum,37.99,77.0,10.0,2925.23,65.297,Mid-Range,Premium,Medium Seller,High,United States,Medium Stock,Fast,Others
Salvatore Ferragamo,Intense Leather by Salvatore Ferragamo for Men 3.4oz (100ML) Eau De Parfum Spray,Men,Parfum,69.95,120.0,5.0,8394.0,104.985,Mid-Range,Premium,High Seller,Medium,United States,Medium Stock,Fast,Others
Michael Kors,Michael Kors Sexy Amber by Michael Kors 3.4 oz EDP For Women Perfume New In Box,Women,EDP,44.99,1647.0,10.0,74098.53,1166.397,Mid-Range,Premium,High Seller,Low,United States,Medium Stock,Fast,Top 10%
GUESS,Guess Marciano perfume for women EDP 3.3 / 3.4 oz New in Box,Women,EDP,20.44,7558.0,35.0,154485.52000000002,5296.731999999999,Budget,Mass Market,High Seller,Low,United States,High Stock,Fast,Top 10%
AS SHOW,Blooming Bouquet Bydior 3.4oz/ 100ml  EDT Perfume for Women Spray Sealed In Box,Women,EDT,74.99,6.0,0.0,449.93999999999994,26.696999999999996,Mid-Range,Premium,Low Seller,Medium,United States,Low Stock,Fast,Others
Burberry,Burberry Her ELIXIR DE PARFUM EDP Intense-Deluxe Travel Spray 0.33oz NEW IN BOX,Women,EDP,13.0,0.0,0.0,0.0,3.9,Budget,Mass Market,Low Seller,High,United States,Low Stock,Fast,Others
Ralph Lauren,Polo Red by Ralph Lauren 4.2 oz EDT Cologne for Men Brand New,Men,EDT,29.46,43.0,10.0,1266.78,38.937999999999995,Budget,Mass Market,Medium Seller,High,United States,Medium Stock,Moderate,Others
Dumont,Dumont Men's Nitro Red EDP Spray 3.4 oz Fragrances 3760060761880,Men,EDP,49.99,187.0,3.0,9348.130000000001,145.897,Mid-Range,Premium,High Seller,Low,United States,Low Stock,Fast,Others
J. Del Pozo,HALLOWEEN MAN J. Del Pozo cologne edt 4.2 oz NEW IN BOX,Men,EDT,27.4,397.0,52.0,10877.8,286.12,Budget,Mass Market,High Seller,Low,United States,High Stock,Fast,Top 25%
Clinique,NEW Aromatics Elixir By Clinique For Women. Body Smoother 6.7 oz/200 ml,Women,Unknown,20.79,33.0,7.0,686.0699999999999,29.336999999999996,Budget,Mass Market,Medium Seller,Medium,United States,Medium Stock,Moderate,Others
Ariana Grande,Ariana Grande Cloud Pink 3.4oz Authentic Pink Perfume Spray Sealed,Women,Unknown,29.99,29.0,10.0,869.7099999999999,29.296999999999997,Budget,Mass Market,Medium Seller,Medium,United States,Medium Stock,Moderate,Others
Paco Rabanne,Paco Rabanne Olympea Intense Eau De Parfum Intense Spray 80 ml / 2.7oz Sealed,Women,Parfum,105.95,22.0,2.0,2330.9,47.185,Luxury,Luxury,Medium Seller,High,United States,Low Stock,Fast,Others
Versace,Versace Men's The Dreamer EDT Spray 3.4 oz (Tester) Fragrances 8011003997848,Men,EDT,23.49,25.0,3.0,587.25,24.547,Budget,Mass Market,Medium Seller,High,United States,Low Stock,Fast,Others
Kenneth Cole Reaction,Kenneth Cole Reaction 3.4 new without box,Men,Unknown,22.99,31.0,10.0,712.6899999999999,28.596999999999998,Budget,Mass Market,Medium Seller,Low,United States,Medium Stock,Moderate,Others
Polo Ralph Lauren,Polo Blue by Ralph Lauren 4.2oz Men's Eau de Toilette Spray EDT New & Sealed Box,Men,EDT,33.99,89.0,8.0,3025.11,72.497,Mid-Range,Premium,Medium Seller,Medium,United States,Medium Stock,Fast,Others
Dolce&Gabbana,The One by Dolce & Gabbana 5 / 5.0 oz EDT Cologne for Men New In Box,Men,EDT,63.69,4733.0,0.0,301444.76999999996,3332.207,Mid-Range,Premium,High Seller,High,United States,Low Stock,Fast,Top 10%
aladdin,Santa fe cologne spray for men  by Aladdin 1.7 oz,Men,Cologne,28.99,3.0,8.0,86.97,10.796999999999999,Budget,Mass Market,Low Seller,Low,United States,Medium Stock,Slow,Others
Burberry,Burberry Brit by Burberry 3.3 / 3.4 oz EDT Perfume for Women New In Box,Women,EDT,35.73,2590.0,557.0,92540.7,1823.7189999999998,Mid-Range,Premium,High Seller,High,United States,High Stock,Moderate,Top 10%
Michael Kors,Michael Kors Sexy Blossom for Women EDP Spray 3.4 oz / 100 ml New In Box,Women,EDP,35.79,110.0,3.0,3936.9,87.737,Mid-Range,Premium,High Seller,Low,United States,Low Stock,Fast,Others
Gucci,Gucci Bloom 3.3oz / 3.4oz Eau de Parfum Women's Fragrance New Sealed,Women,Parfum,64.99,35.0,10.0,2274.6499999999996,43.997,Mid-Range,Premium,Medium Seller,Medium,United States,Medium Stock,Moderate,Others
Oscar de la Renta,OSCAR by Oscar de la Renta for women EDT 6.7 oz New in Box,Women,EDT,43.39,678.0,0.0,29418.420000000002,487.61699999999996,Mid-Range,Premium,High Seller,Low,United States,Low Stock,Fast,Top 25%
As Show,A-ventus Eau De Parfum For Men Millesime EDP Cologne New In Box 3.3 Oz /100ML,Men,EDP,109.99,24.0,3.0,2639.7599999999998,49.797,Luxury,Luxury,Medium Seller,Medium,Hong Kong,Low Stock,Fast,Others
Versace,Versace Bright Crystal by Versace for Women EDT Spray 3.0 oz / 90 ml New In Box,Women,EDT,29.99,251.0,0.0,7527.49,184.697,Budget,Mass Market,High Seller,High,United States,Low Stock,Fast,Others
Maison Margiela,Maison Margiela Replica Sailing Day Eau de Toilette 3.4 oz New in Box US,Women,Eau De Toilette,48.88,14.0,10.0,684.32,24.464,Mid-Range,Premium,Low Seller,Low,United States,Medium Stock,Slow,Others
AS  SHOWN,Women Perfume 3.4 oz / 100 ml Eau De Toilette Spray,Women,Eau De Toilette,30.98,12.0,10.0,371.76,17.694,Mid-Range,Premium,Low Seller,Low,China,Medium Stock,Slow,Others
Valentino,New Valentino Donna Born In Roma Intense 3.4 oz EDP Intense Spray For Women,Women,EDP,99.99,19.0,0.0,1899.81,43.297,Luxury,Luxury,Low Seller,Medium,United States,Low Stock,Fast,Others
Bellie Eilish,Eilish by Bellie Eilish 3.4 oz / 100 ml EDP Perfume Spray for Women New In Box,Women,EDP,49.99,38.0,4.0,1899.6200000000001,41.596999999999994,Mid-Range,Premium,Medium Seller,Low,Hong Kong,Low Stock,Fast,Others
Cologne,Lane Frost Frosted Cologne,Men,Cologne,35.0,8.0,2.0,280.0,16.1,Mid-Range,Premium,Low Seller,Medium,United States,Low Stock,Moderate,Others
Maison Alhambra,Maison Alhambra Ladies Reyna Pour Femme EDP 3.4 oz Fragrances 6290360590721,Women,EDP,27.89,8.0,3.0,223.12,13.966999999999999,Budget,Mass Market,Low Seller,Medium,United States,Low Stock,Slow,Others
Armaf,Club de Nuit Intense by Armaf cologne for men EDT 3.6 oz New in Box,Men,EDT,30.58,31.0,10.0,947.9799999999999,30.874,Mid-Range,Premium,Medium Seller,High,United States,Medium Stock,Moderate,Others
Parfums de Marly,New Parfums de Marly Kalan by Parfums de Marly 4.2 oz EDP Spray for Men Cologne,Men,EDP,82.99,5.0,3.0,414.95,28.397,Luxury,Luxury,Low Seller,Medium,United States,Low Stock,Slow,Others
Unbranded,Yara by Lattafa Perfumes | Eau De Parfum-100ml (3.4 fl oz) |-Female Long Lasting,Women,Parfum,15.89,434.0,10.0,6896.26,308.56699999999995,Budget,Mass Market,High Seller,High,China,Medium Stock,Fast,Others
Clean,Clean Reserve Skin by Clean Eau De Parfum Spray (Unisex Tester) 3.4 oz For Women,Women,Parfum,66.69,6.0,8.0,400.14,24.206999999999997,Mid-Range,Premium,Low Seller,Low,United States,Medium Stock,Slow,Others
Unbranded,"Sweet Tooth Eau de Parfum, Perfume for Women, 1 fl oz",Women,Parfum,30.96,3.0,2.0,92.88,11.388,Mid-Range,Premium,Low Seller,High,United States,Low Stock,Slow,Others
Luxury,Luxury by New Brand cologne for men EDT 3.3 /3.4 oz New In Box,Men,EDT,10.67,272.0,57.0,2902.24,193.60099999999997,Budget,Mass Market,High Seller,Low,United States,High Stock,Moderate,Others
Jaguar,JAGUAR by Jaguar for Men Green Cologne 3.4 oz Spray edt New in Box,Men,EDT,15.65,2777.0,93.0,43460.05,1948.5949999999998,Budget,Mass Market,High Seller,Low,United States,High Stock,Fast,Top 10%
Fragrance Couture,Perfume for Men's Valentine Milano Cologne 3.4 Fl.oz EDT Best Gift Fast Shipping,Men,EDT,14.98,206.0,0.0,3085.88,148.694,Budget,Mass Market,High Seller,Low,United States,Low Stock,Fast,Others
Armaf,"ARMAF CLUB DE NUIT 3.4 OZ, EDP FOR WOMEN IN SEALED BOX",Women,EDP,29.45,355.0,10.0,10454.75,257.335,Budget,Mass Market,High Seller,High,United States,Medium Stock,Fast,Top 25%
Maison Alhambra,Glacier Bold EDP Perfume By Maison Alhambra Lattafa 100 ML New Release,Women,EDP,37.99,16.0,10.0,607.84,22.597,Mid-Range,Premium,Low Seller,Medium,United States,Medium Stock,Slow,Others
Burberry,Burberry Touch by Burberry parfum for women 3.3 fl. oz. / 100 ml,Women,Parfum,26.0,5.0,5.0,130.0,11.3,Budget,Mass Market,Low Seller,High,United States,Medium Stock,Slow,Others
Dolce Gabbana,Dolce Gabbana Queen EDP Perfume for Women 3.4 oz Eau de Parfum Spray New Box,Women,EDP,38.99,122.0,3.0,4756.780000000001,97.097,Mid-Range,Premium,High Seller,Low,Hong Kong,Low Stock,Fast,Others
Hollister,Hollister Jake Cologne Eau De Cologne 1.7 Oz/50 ml Ne🦋 Sealed Men,Men,Cologne,28.97,12.0,9.0,347.64,17.090999999999998,Budget,Mass Market,Low Seller,Low,United States,Medium Stock,Slow,Others
Kenneth Cole,Blue Kenneth Cole Cologne for Men 3.4 oz 3.3 edt Spray New in Box,Men,EDT,28.42,731.0,60.0,20775.02,520.226,Budget,Mass Market,High Seller,Low,United States,High Stock,Fast,Top 25%
Coach,COACH Floral Blush by Coach perfume for women EDP 3 / 3.0 oz New in Box,Women,EDP,38.92,2515.0,141.0,97883.8,1772.176,Mid-Range,Premium,High Seller,Medium,United States,High Stock,Fast,Top 10%
Valentino,Valentino Donna Born In Roma Eau De Parfum  2ML Spray For Women,Women,Parfum,9.7,2.0,10.0,19.4,4.31,Budget,Mass Market,Low Seller,Medium,United States,Medium Stock,Slow,Others
Calvin Klein,Truth by Calvin Klein 3.4 oz EDT Cologne for Men New In Box,Men,EDT,31.57,287.0,10.0,9060.59,210.37099999999998,Mid-Range,Premium,High Seller,High,United States,Medium Stock,Fast,Others
SECERTMU,"50ML Savagery Pheromone Men Perfume, Pheromone Cologne for Men Attract Women",Men,Cologne,11.99,51.0,10.0,611.49,39.297,Budget,Mass Market,Medium Seller,Low,United States,Medium Stock,Moderate,Others
Victor & Rolf,Victor & Rolf Spicebomb Extreme EDP 1.7 oz/ 50 ML  Spray For Men,Men,EDP,74.59,1.0,10.0,74.59,23.076999999999998,Mid-Range,Premium,Low Seller,Low,United States,Medium Stock,Slow,Others
Robert Piguet,Rollerball Fracas by Robert Piguet Eau De Parfum 0.25 oz / 7.5 ml new,Women,Parfum,29.95,14.0,10.0,419.3,18.784999999999997,Budget,Mass Market,Low Seller,Low,United States,Medium Stock,Slow,Others
PRADA,Prada Paradoxe Intense Women Eau De Parfum Spray 1.6 oz 50ml New In Box,Women,Parfum,88.0,13.0,2.0,1144.0,35.5,Luxury,Luxury,Low Seller,Medium,United States,Low Stock,Moderate,Others
Zara,2 ZARA Red Temptation Spray  They Maybe Expired Strong Alcohol Smell NO RETURNS!,Women,Unknown,15.0,10.0,5.0,150.0,11.5,Budget,Mass Market,Low Seller,Low,United States,Medium Stock,Slow,Others
Unbranded,SOL DE JANEIRO Brazilian Crush 39 Perfume Body Mist Fragrance 3.4floz New in Box,Women,Unknown,19.75,33.0,10.0,651.75,29.025,Budget,Mass Market,Medium Seller,High,Hong Kong,Medium Stock,Moderate,Others
Yves Saint Laurent,YSL Y Eau Fraiche (3.3 Oz/100 ML) Eau De Toilette Spray *Rare/Discontinued*,Men,Eau De Toilette,92.0,9.0,0.0,828.0,33.9,Luxury,Luxury,Low Seller,High,United States,Low Stock,Fast,Others
Unbranded,SEALED NEW CUPID 2.0 HYPNOSIS MEN’S PHEROMONE COLOGNE 1.7 OZ MEET MORE HOT WOMEN,Men,Cologne,15.99,14.0,10.0,223.86,14.596999999999998,Budget,Mass Market,Low Seller,High,United States,Medium Stock,Slow,Others
Cartier,DECLARATION by Cartier edt Cologne 3.3 oz / 3.4 oz New tester,Men,EDT,59.63,48.0,24.0,2862.2400000000002,51.48899999999999,Mid-Range,Premium,Medium Seller,Low,United States,High Stock,Slow,Others
Armaf,Le Femme by Armaf perfume for women EDP 3.3 / 3.4 oz New in Box,Women,EDP,20.71,290.0,100.0,6005.900000000001,209.213,Budget,Mass Market,High Seller,High,United States,High Stock,Moderate,Others
Maison Alhambra,Glacier Bold EDP Perfume By Maison Alhambra Lattafa 100 M 💯 (Le Beau Le Perfume,Women,EDP,34.0,45.0,10.0,1530.0,41.699999999999996,Mid-Range,Premium,Medium Seller,Medium,United States,Medium Stock,Moderate,Others
Tommy Bahama,Tommy Bahama Maritime Deep Blue for Men 4.2 oz 125 ML Cologne Spray NEW AS PIC**,Men,Cologne,25.99,209.0,6.0,5431.91,154.09699999999998,Budget,Mass Market,High Seller,Low,United States,Medium Stock,Fast,Others
Christian Dior,SAUVAGE by Christian Dior For Men PARFUM 6.8 oz / 200 ml *NEW IN SEALED BOX*,Men,Parfum,161.99,129.0,10.0,20896.710000000003,138.897,Luxury,Luxury,High Seller,Low,United States,Medium Stock,Fast,Top 25%
Michael Malul London,Michael Malul Ocean Noir 3.4 oz / 100 ml eau de parfum for men Spray New,Men,Parfum,90.11,51.0,10.0,4595.61,62.73299999999999,Luxury,Luxury,Medium Seller,Low,United States,Medium Stock,Moderate,Others
Carolina Herrera,Carolina Herrera Good Girl BLUSH Womens Perfume EDP Mini 0.24 oz NWOB,Women,EDP,24.99,55.0,6.0,1374.4499999999998,45.997,Budget,Mass Market,Medium Seller,High,United States,Medium Stock,Fast,Others
Roberto Cavalli,Roberto Cavalli Men's Uomo EDT Spray 3.4 oz (100 ml) Sealed,Men,EDT,42.95,8.0,10.0,343.6,18.485,Mid-Range,Premium,Low Seller,Low,United States,Medium Stock,Slow,Others
Giorgio Armani,Giorgio Armani Acqua Di Gio 6.7 oz/200 ml Men's Eau de Toilette Spray,Men,Eau De Toilette,48.95,121.0,10.0,5922.950000000001,99.38499999999999,Mid-Range,Premium,High Seller,High,United States,Medium Stock,Fast,Others
Afnan,Afnan Men's Supremacy In Heaven EDP Spray 3.38 oz/100ML (Tester) Fragrances,Men,EDP,23.49,14.0,3.0,328.85999999999996,16.846999999999998,Budget,Mass Market,Low Seller,Medium,United States,Low Stock,Moderate,Others
Afnan,Turathi Blue by Afnan EDP Spray for Men 3.0oz New Sealed Box,Men,EDP,34.5,16.0,2.0,552.0,21.549999999999997,Mid-Range,Premium,Low Seller,Medium,United States,Low Stock,Fast,Others
BOD man,"BOD Man Fragrance Body Spray, Black, 8 fl oz Fresh Free Shipping",Men,Unknown,9.99,32.0,3.0,319.68,25.397,Budget,Mass Market,Medium Seller,Low,United States,Low Stock,Fast,Others
Jean Paul Gaultier,Jean Paul Gaultier Le Beau 4.2 oz. Eau de Toilette Spray for Men New and Sealed,Men,Eau De Toilette,136.0,51.0,5.0,6936.0,76.5,Luxury,Luxury,Medium Seller,Medium,United States,Medium Stock,Fast,Others
SECERTMU,Men's Perfume Pheromone- Infused Cupid Hypnosis Cologne Fragrances Charm Spray！,Men,Cologne,12.99,10.0,10.0,129.9,10.897,Budget,Mass Market,Low Seller,Low,United States,Medium Stock,Slow,Others
Lattafa,Qaed Al Fursan by Lattafa perfume for unisex EDP 3.04 oz New in Box,Men,EDP,21.54,989.0,96.0,21303.059999999998,698.762,Budget,Mass Market,High Seller,Medium,United States,High Stock,Fast,Top 25%
Givenchy,L'Interdit by Givenchy Eau De Toilette For Women 2.6 oz / 80 ml *NEW*,Women,Eau De Toilette,41.99,39.0,10.0,1637.6100000000001,39.897,Mid-Range,Premium,Medium Seller,Medium,United States,Medium Stock,Moderate,Others
Versace,Versace Bright Crystal Absolu by Versace perfume for her EDP 3.0 oz New in Box,Women,EDP,54.9,1224.0,72.0,67197.59999999999,873.27,Mid-Range,Premium,High Seller,High,United States,High Stock,Fast,Top 10%
Givenchy,Gentleman Boisee by Givenchy cologne for men EDP 3.3 / 3.4 oz New in Box,Men,EDP,73.52,8.0,4.0,588.16,27.656,Mid-Range,Premium,Low Seller,Medium,United States,Low Stock,Slow,Others
John Varvatos,XX Artisan by John Varvatos cologne for men EDT 4.2 oz New Tester,Men,EDT,29.2,121.0,21.0,3533.2,93.46,Budget,Mass Market,High Seller,Low,United States,High Stock,Fast,Others
Designer Series,Free Shipping PERFUME For Men BLUE 100ml 3.4fl.oz Long Lasting Fragrance Cologne,Men,Cologne,12.6,229.0,10.0,2885.4,164.07999999999998,Budget,Mass Market,High Seller,Low,United States,Medium Stock,Fast,Others
Juicy Couture,COUTURE LA LA Juicy Couture women perfume edp 3.4 oz 3.3 NEW IN BOX,Women,EDP,24.24,3152.0,251.0,76404.48,2213.6719999999996,Budget,Mass Market,High Seller,Medium,United States,High Stock,Fast,Top 10%
Paris Hilton,PARIS HILTON ELECTRIFY for Women Cologne 3.4 oz 100 ml Eau de Parfum Spray UNBOX,Women,Parfum,14.99,51.0,4.0,764.49,40.196999999999996,Budget,Mass Market,Medium Seller,Low,United States,Low Stock,Fast,Others
Lattafa,Lattafa Men's Hayaati Al Maleky EDP Spray 3.4 oz Fragrances 6291108734056,Men,EDP,16.91,156.0,0.0,2637.96,114.27299999999998,Budget,Mass Market,High Seller,Medium,United States,Low Stock,Fast,Others
As Show,J'adore Parfum D'eau by Christian 3.4 oz EDP Fragrance for Women New In Box,Women,EDP,59.99,9.0,10.0,539.91,24.297,Mid-Range,Premium,Low Seller,Medium,Hong Kong,Medium Stock,Slow,Others
Miim Miic,Miim Miic Compound 52 Hair & Body Mist Sweet Strawberry Milk 8 fl oz NEW!,Women,Unknown,26.95,4.0,3.0,107.8,10.884999999999998,Budget,Mass Market,Low Seller,Low,United States,Low Stock,Slow,Others
Yves Saint Laurent,Y by Yves Saint Laurent cologne for men EDT 3.3 / 3.4 oz New,Men,EDT,57.17,210.0,7.0,12005.7,164.151,Mid-Range,Premium,High Seller,High,United States,Medium Stock,Fast,Top 25%
Juliette has a gun,Not a Perfume By Juliette Has A Gun Eau De Parfum Spray 3.3 oz 100ml For Women,Women,Parfum,42.99,32.0,10.0,1375.68,35.297,Mid-Range,Premium,Medium Seller,Medium,United States,Medium Stock,Moderate,Others
Narciso Rodriguez,Narciso Rodriguez For Her 3.3oz EDP Signature Women's Perfume Spray New,Women,EDP,34.99,26.0,10.0,909.74,28.697,Mid-Range,Premium,Medium Seller,Medium,United States,Medium Stock,Moderate,Others
AS SHOWN,Sauvage Eau De Parfum Spray 3.4 oz/100 ml For Men New In Box,Men,Parfum,69.99,11.0,4.0,769.89,28.696999999999996,Mid-Range,Premium,Low Seller,Medium,Hong Kong,Low Stock,Moderate,Others
PRADA,PRADA Paradoxe by Prada EDP 3.0oz/90ml Spray Perfume for Women New In Box,Women,EDP,59.99,35.0,10.0,2099.65,42.497,Mid-Range,Premium,Medium Seller,Medium,United States,Medium Stock,Moderate,Others
Narciso Rodriguez,Narciso Rodriguez for Her 3.3 fl oz / 100 ml EDP New Sealed Free Shipping,Women,EDP,31.0,266.0,4.0,8246.0,195.5,Mid-Range,Premium,High Seller,Medium,United States,Low Stock,Fast,Others
